{
  "artifact_path": null,
  "artifact_sha256": null,
  "calibration": {},
  "card": {
    "ethical_and_safety_notes": "Output is a recommendation, never an action. Policy and the Safety Governor stand between this model and any device.",
    "evaluation": "Held-out final 5 days; mean absolute error 0.6 \u00b0C.",
    "intended_use": "Proposing a comfort setpoint for review. Advisory only.",
    "limitations": "Cold-starts for the first three weeks and after a household change. Suspended automatically when drift is detected.",
    "out_of_scope_use": "Any safety decision, any life-safety actuator, and any home other than the one it was trained on.",
    "privacy_classification": "HOUSEHOLD_PRIVATE",
    "summary": "Predicts the temperature this household chooses at this hour.",
    "training_data": "21 days of this home's own thermostat changes. No data leaves the hub."
  },
  "created_at": "2026-08-20T19:30:00Z",
  "evaluation_metrics": {
    "mean_absolute_error_celsius": 0.6
  },
  "feature_schema_version": "1.0",
  "home_id": "home_example",
  "metadata": {},
  "model_id": "88888888-8888-4888-8888-888888888888",
  "model_type": "TEMPERATURE_PREFERENCE",
  "name": "temperature_preference",
  "promoted_at": null,
  "rollback_target": null,
  "runtime": "onnxruntime",
  "status": "TRAINED",
  "supported_hardware": [
    "cpu"
  ],
  "training_code_revision": "0000000000000000000000000000000000000000",
  "training_window": {
    "distinct_days": 22,
    "end": "2026-08-20T19:30:00Z",
    "sample_count": 177,
    "start": "2026-07-30T19:30:00Z"
  },
  "version": "1.0.0"
}
